### ISSUE TITLE
PSM connecting but not recognising packets?

### ISSUE THREAD

**Issue by Ruukha** [stopperw/pain-studio-mask#8]
Whenever i try using PSM, it connects properly, but when i try to draw i get spammed with "[W] Ignoring packet with out of range coordinates! You might need to check your psm.json." on my logs. 
When i try listening on the port via `sudo tcpdump -i lo -A port 40302`, this is the pattern that shows up:
11:42:53.899429 IP localhost.32796 > localhost.40302: Flags [P.], seq 192667:192788, ack 1, win 64, options [nop,nop,TS val 3657667845 ecr 1402778025], length 121
E...K.@.@..e...........n.+<..X.Z...@.......
....S...{"type":"TabletEvent","status":0,"buttons":1,"x":396742,"y":453282,"z":0,"normal_pressure":29634,"tangential_pressure":0}
11:42:53.899519 IP localhost.40302 > localhost.32796: Flags [.], ack 192788, win 64, options [nop,nop,TS val 1402778025 ecr 3657667845], length 0
E..4R:@.@............n...X.Z.+=Y...@.(.....
S.......
11:42:53.905358 IP localhost.32796 > localhost.40302: Flags [P.], seq 192788:192792, ack 1, win 64, options [nop,nop,TS val 3657667851 ecr 1402778025], length 4
E..8K.@.@..............n.+=Y.X.Z...@.,.....
....S......y
11:42:53.905435 IP localhost.40302 > localhost.32796: Flags [.], ack 192792, win 64, options [nop,nop,TS val 1402778031 ecr 3657667851], length 0
E..4R;@.@............n...X.Z.+=]...@.(.....
S.......
11:42:53.905446 IP localhost.32796 > localhost.40302: Flags [P.], seq 192792:192913, ack 1, win 64, options [nop,nop,TS val 3657667851 ecr 1402778031], length 121
E...K.@.@..c...........n.+=].X.Z...@.......
....S...{"type":"TabletEvent","status":0,"buttons":1,"x":396742,"y":453282,"z":0,"normal_pressure":29630,"tangential_pressure":0}

These values are well within the range of 1920000,  1080000, 32767 as stated in the psm.json, which is both in ~/.config/OpenTabletDriver/Plugins/PSM/psm.json and ~/.wine/drive_c/Program Files/CELSYS/CLIP STUDIO 1.5/CLIP STUDIO PAINT/psm.json, right next to wintab32.dll
I've followed exactly the steps in the tutorial on how to install Clip Studio Paint on Linux from the md in this repository. Also something i should note is that psm.json generates in ~/, instead of ~/.config/OpenTabletDriver/Plugins/PSM/

**Comment by stopperw** [comment]
[This build](https://github.com/stopperw/pain-studio-mask/actions/runs/22355155720/artifacts/5636423700) (https://github.com/stopperw/pain-studio-mask/commit/71211ff3316f5ec15933540fdd06dc4bc108d4db) should fix your issue.

**Comment by Ruukha** [comment]
While it did stop the out-of-range error, pressure still doesn't seem to be working

**Comment by Ruukha** [comment]
For some reason it did work when using bottles, but not standard wine, although clip studio launcher is also working (except pop-up screens, such as log-in screen (you can log in from clip studio paint normally) or the settings one, but you can download stuff normally). For anyone wondering, this is my bottle yml (sorry for not uploading it as a file, github isn't letting me upload files for some reason):
```
Arch: win64
CompatData: ''
Creation_Date: '2026-03-20 22:00:49.885214'
Custom_Path: false
DLL_Overrides: {}
DXVK: dxvk-2.7.1-12-9963ecd
Environment: Application
Environment_Variables:
    WEBVIEW2_ADDITIONAL_BROWSER_ARGUMENTS: --ignore-gpu-blocklist --disable-gpu-driver-bug-workarounds
External_Programs:
    e7f96e1d-b730-44b5-85f7-3b0cfadefde0:
        executable: CLIPStudioPaint.exe
        folder: /home/ruukha/.var/app/com.usebottles.bottles/data/bottles/bottles/clip-studio/drive_c/Program
            Files/CELSYS/CLIP STUDIO 1.5/CLIP STUDIO PAINT
        id: e7f96e1d-b730-44b5-85f7-3b0cfadefde0
        name: CLIPStudioPaint
        path: /home/ruukha/.var/app/com.usebottles.bottles/data/bottles/bottles/clip-studio/drive_c/Program
            Files/CELSYS/CLIP STUDIO 1.5/CLIP STUDIO PAINT/CLIPStudioPaint.exe
Inherited_Environment_Variables:
- DBUS_SESSION_BUS_ADDRESS
- DISPLAY
- HOME
- LANG
- LC_ALL
- LC_CTYPE
- LC_MESSAGES
- PATH
- PULSE_SERVER
- TERM
- TZ
- USER
- WAYLAND_DISPLAY
- XAUTHORITY
- XDG_RUNTIME_DIR
Installed_Dependencies:
- arial32
- times32
- courie32
- mono
- gecko
- vcredist2019
- andale32
- arialb32
- comic32
- georgi32
- impact32
- tahoma32
- trebuc32
- verdan32
- webdin32
- allfonts
- d3dcompiler_47
Language: sys
LatencyFleX: latencyflex-v0.1.1
Limit_System_Environment: true
NVAPI: dxvk-nvapi-v0.9.1
Name: clip-studio
Parameters:
    custom_dpi: 96
    decorated: true
    discrete_gpu: false
    dxvk: true
    dxvk_nvapi: false
    fixme_logs: false
    fsr: false
    fsr_sharpening_strength: 8
    fullscreen_capture: false
    gamemode: false
    gamescope: false
    gamescope_borderless: false
    gamescope_custom_options: ''
    gamescope_fps: 0
    gamescope_fps_no_focus: 0
    gamescope_fullscreen: true
    gamescope_game_height: 0
    gamescope_game_width: 0
    gamescope_scaling: false
    gamescope_window_height: 0
    gamescope_window_width: 0
    latencyflex: false
    mangohud: false
    mangohud_display_on_game_start: true
    mouse_warp: true
    obsvkc: false
    pulseaudio_latency: false
    renderer: gl
    sandbox: false
    sync: wine
    take_focus: false
    use_be_runtime: true
    use_eac_runtime: true
    use_runtime: false
    use_steam_runtime: false
    versioning_automatic: false
    versioning_compression: false
    versioning_exclusion_patterns: false
    virtual_desktop: false
    virtual_desktop_res: 1280x720
    vkbasalt: false
    vkd3d: true
    vmtouch: false
    vmtouch_cache_cwd: false
    wayland: false
    winebridge: false
Path: clip-studio
Registry_Rules: []
Runner: ge-proton10-33
RunnerPath: ''
Sandbox:
    share_net: false
    share_sound: false
State: 0
Uninstallers: {}
Update_Date: '2026-04-07 16:23:18.934708'
VKD3D: vkd3d-proton-3.0
Versioning: false
Versioning_Exclusion_Patterns: []
Windows: win10
Winebridge: false
WorkingDir: ''
data: {}
run_in_terminal: false
session_arguments: ''
```
